"","title","description","redirect_url","latitude","longitude","salary_max","salary_is_predicted","id","salary_min","adref","created","__CLASS__","contract_type","contract_time","__CLASS__","label","tag","__CLASS__","display_name","display_name","__CLASS__","area"
"1","Registered Nurse","Nurses change lives As a Registered Nurse in Hinckley, Leicester and the surrounds, you'll work in a variety of care homes and other establishments in your area. You'll be providing high quality nursing care to our service users at all times. We're powered by our fantastic network of 9,000-strong healthcare professionals and bespoke tech that offers a market-leading employee experience. Thanks to our handy app, HealthForceGo, you can pick up shifts to suit you when you're on the go, and you are＃","https://www.adzuna.co.uk/jobs/land/ad/1853339471?se=gkLvVr076xGf5tUtexr6aQ&utm_medium=api&utm_source=f0c87e31&v=30491FF103DF0E8D0134DF5E70820F073D723E0D",52.6348,-1.12952,54009,"0","1853339471",0,"eyJhbGciOiJIUzI1NiJ9.eyJpIjoiMTg1MzMzOTQ3MSIsInMiOiJna0x2VnIwNzZ4R2Y1dFV0ZXhyNmFRIn0.37GJxCb23yxMA-p-d7QFPs6dQmNCvEbP4a4c10NwaWU","2020-12-01T00:21:42Z","Adzuna::API::Response::Job",NA,NA,"Adzuna::API::Response::Category","Healthcare & Nursing Jobs","healthcare-nursing-jobs","Adzuna::API::Response::Company","Newcross Healthcare Solutions","Leicester, Leicestershire","Adzuna::API::Response::Location","c(""UK"", ""East Midlands"", ""Leicestershire"", ""Leicester"")"
"2","Community Care Worker","Make a difference every day 每 Become a care assistant. Nothing compares to the feeling that comes from knowing that you＊ve brightened up someone＊s day 每 especially when that someone is a vulnerable adult. Abacare are on the hunt for warm and kind people like you to join our amazing team of part and full time care assistants in CG37, CF38, CF44, CF45 The fact that you＊re thinking about becoming a care assistant makes you part of a special group of people 每 the most compassionate and interesting ＃","https://www.adzuna.co.uk/jobs/land/ad/1861124491?se=gkLvVr076xGf5tUtexr6aQ&utm_medium=api&utm_source=f0c87e31&v=CEBBDC32B6D203B5EF51945F0EF8CC3398A08820",51.713699,-3.44509,16800,"0","1861124491",16800,"eyJhbGciOiJIUzI1NiJ9.eyJzIjoiZ2tMdlZyMDc2eEdmNXRVdGV4cjZhUSIsImkiOiIxODYxMTI0NDkxIn0.-hS9fjiLv4Zi1jheIJw5cO2VsU5UAtdYWj_qMToJbOY","2020-12-04T08:15:08Z","Adzuna::API::Response::Job",NA,NA,"Adzuna::API::Response::Category","Social work Jobs","social-work-jobs","Adzuna::API::Response::Company","Abacare","Aberdare, Rhondda Cynon Taff","Adzuna::API::Response::Location","c(""UK"", ""Wales"", ""Rhondda Cynon Taff"", ""Aberdare"")"
"3","Night Worker","Night Worker - Winchester Permanent 42 hours per week - ㏒21,415 Are you looking for a challenging and rewarding role where you are able to support people every day and provide a safe environment for them to feel safe and comfortable? Do you enjoy working in an environment where every shift is different to the next? Then this could be the role for you. You will be working as part of the night team to provide support to our homeless clients. You will love helping others by being on hand when they＃","https://www.adzuna.co.uk/jobs/land/ad/1871673352?se=gkLvVr076xGf5tUtexr6aQ&utm_medium=api&utm_source=f0c87e31&v=BB14F405D3F3DDDE511EF8DC9BD6A5114FA3CDB1",51.062901,-1.3165,21415,"0","1871673352",21415,"eyJhbGciOiJIUzI1NiJ9.eyJpIjoiMTg3MTY3MzM1MiIsInMiOiJna0x2VnIwNzZ4R2Y1dFV0ZXhyNmFRIn0.RlIH9LwMw5Dj-AM9a3MD-uZCR78ReucWunAXd9gnw5c","2020-12-09T18:18:03Z","Adzuna::API::Response::Job",NA,NA,"Adzuna::API::Response::Category","Social work Jobs","social-work-jobs","Adzuna::API::Response::Company","Two Saints Housing Association","Winchester, Hampshire","Adzuna::API::Response::Location","c(""UK"", ""South East England"", ""Hampshire"", ""Winchester"")"
"4","Senior Registered Nurse with up to ㏒2000 welcome incentive","Job Description Senior Registered Nurse -with up to ㏒2000 welcome incentive (terms apply) Advert created: 11/11/2020 Ref: coltencare/AC/84/222 Advert closing date: 11/12/2020 Please note you will be contacted prior to the closing date, interviews will be ongoing and we may close this vacancy early . Based at Avon Cliff, Bournemouth in Dorset. 36 hours per week, days, including alternate weekends and occasional nights Additional hours / overtime opportunities available to suit your circumstances＃","https://www.adzuna.co.uk/jobs/land/ad/1816381762?se=gkLvVr076xGf5tUtexr6aQ&utm_medium=api&utm_source=f0c87e31&v=2901D24701301855C65452491DEE4429942F87A3",50.721699,-1.87853,46310,"0","1816381762",0,"eyJhbGciOiJIUzI1NiJ9.eyJpIjoiMTgxNjM4MTc2MiIsInMiOiJna0x2VnIwNzZ4R2Y1dFV0ZXhyNmFRIn0.sXHpe1mZLRGzh2djQV0ewiBdq0Wxmeh5YYUXpO8cfTY","2020-11-11T20:09:44Z","Adzuna::API::Response::Job",NA,NA,"Adzuna::API::Response::Category","Healthcare & Nursing Jobs","healthcare-nursing-jobs","Adzuna::API::Response::Company","Colten Care Ltd","Bournemouth, Dorset","Adzuna::API::Response::Location","c(""UK"", ""South West England"", ""Dorset"", ""Bournemouth"")"
"5","Software Development, Testing and Dev Ops graduate programme","Software Development and Implementation programme (Java, Testing, Dev Ops) Ignite your career in IT with Capita Capita has been working across the public and private sectors for more than 30 years improving customer and public services and adding value to the UK and local economies. Our 61,000 employees combine our talent, creativity, software, technology and innovation to deliver business critical services and solutions across all our markets, solving the complex challenges of our clients, inc＃","https://www.adzuna.co.uk/jobs/land/ad/1857408425?se=gkLvVr076xGf5tUtexr6aQ&utm_medium=api&utm_source=f0c87e31&v=898420DE0C0A9F5142CEA8FF9103F045817E34BE",51.451818,-0.02806,24500,"0","1857408425",0,"eyJhbGciOiJIUzI1NiJ9.eyJzIjoiZ2tMdlZyMDc2eEdmNXRVdGV4cjZhUSIsImkiOiIxODU3NDA4NDI1In0.dejsdBnXER_ggF8ko4ONq4hnsMKYkwFBAOfQlc6odww","2020-12-02T16:18:25Z","Adzuna::API::Response::Job",NA,NA,"Adzuna::API::Response::Category","Graduate Jobs","graduate-jobs","Adzuna::API::Response::Company","Capita","South East London, London","Adzuna::API::Response::Location","c(""UK"", ""London"", ""South East London"")"
"6","Support Worker","Job Title: Support Worker Location: Reigate, RH2 Hours: part time Salary: ㏒8.80 Information: This role is shift work. Driver, full UK driving licence, is desired not essential What do our Support Workers do? Supporting someone isn＊t just personal care; it＊s so much more. As a Support Worker you could be supporting individuals with swimming, assisting with the weekly shop, or even helping to administer the right medication. Our Support Workers are focused on active listening, meaningful engageme＃","https://www.adzuna.co.uk/jobs/land/ad/1848556338?se=gkLvVr076xGf5tUtexr6aQ&utm_medium=api&utm_source=f0c87e31&v=A3F095741D25285176A8845AB521A6E3512A09DD",51.237598,-0.205832,16896,"0","1848556338",16896,"eyJhbGciOiJIUzI1NiJ9.eyJzIjoiZ2tMdlZyMDc2eEdmNXRVdGV4cjZhUSIsImkiOiIxODQ4NTU2MzM4In0.WRsR7aVmqAZZeYdT_UKDghfphcpdwzO3JI3DM3GtQuY","2020-11-28T02:10:35Z","Adzuna::API::Response::Job",NA,NA,"Adzuna::API::Response::Category","Social work Jobs","social-work-jobs","Adzuna::API::Response::Company","Achieve together","Reigate, Surrey","Adzuna::API::Response::Location","c(""UK"", ""South East England"", ""Surrey"", ""Reigate"")"
"7","Lead JavaScript Developer","My client is looking to recruit a passionate Lead Full Stack Software Engineer who is experienced with the full Secure Software Development Life Cycle (SSDLC), change management, and modern tools and pipelines. We're open to someone who is technology agnostic who is excited by the prospect of working with new and latest technologies. The successful candidate will be able to lead a small but growing team of software engineers, act as a technical lead and be comfortable developing exciting greenf＃","https://www.adzuna.co.uk/jobs/land/ad/1795121300?se=gkLvVr076xGf5tUtexr6aQ&utm_medium=api&utm_source=f0c87e31&v=F025198C549336B5722EA7189B422FCDA957E5E1",NA,NA,80000,"0","1795121300",60000,"eyJhbGciOiJIUzI1NiJ9.eyJzIjoiZ2tMdlZyMDc2eEdmNXRVdGV4cjZhUSIsImkiOiIxNzk1MTIxMzAwIn0.9WqpG4eRbUeWZl6TeJ3W4A1I8VLrIDjWFUu52sfF7hY","2020-10-31T23:38:20Z","Adzuna::API::Response::Job",NA,NA,"Adzuna::API::Response::Category","IT Jobs","it-jobs","Adzuna::API::Response::Company","Rbw Consulting Limited","The City, Central London","Adzuna::API::Response::Location","c(""UK"", ""London"", ""Central London"", ""The City"")"
"8","Community adviser working with the Roma community","Community advisers working with the Roma community 25 hours a week Contract: 1 st February 2021 to 7 th May 2021 plus holiday Salary dependent on location Band 1 - ㏒16.93 Band 2 - ㏒14.67 Band 3 - ㏒13.01 Hours are flexible and need to be worked to best support the community the role works with (this will include some evening and weekend work) Use your language skills to make a difference The census is a survey of the entire population of England and Wales that happens every 10 years. It＊s run by＃","https://www.adzuna.co.uk/jobs/land/ad/1833856202?se=gkLvVr076xGf5tUtexr6aQ&utm_medium=api&utm_source=f0c87e31&v=379C7E74A119005456B75E85CB99003FA3AE608C",53.4338,-2.907,17781.92,"1","1833856202",17781.92,"eyJhbGciOiJIUzI1NiJ9.eyJzIjoiZ2tMdlZyMDc2eEdmNXRVdGV4cjZhUSIsImkiOiIxODMzODU2MjAyIn0.zM0u_8lAw5o25ItVbT1kNCNFUptwwZAbJRv4k70wfco","2020-11-19T20:36:47Z","Adzuna::API::Response::Job",NA,NA,"Adzuna::API::Response::Category","Social work Jobs","social-work-jobs","Adzuna::API::Response::Company","Office for National Statistics   Census","West Derby, Liverpool","Adzuna::API::Response::Location","c(""UK"", ""North West England"", ""Merseyside"", ""Liverpool"", ""West Derby"")"
"9","Nurse","Staff Nurse - ㏒19 to ㏒40 per hour - Lots of Work  Ltd Company Nurses Welcome  WANT TO EARN OVER ㏒1,000 PER WEEK AND UP TO ㏒1,500 A WEEK AS AN AGENCY STAFF NURSE ((RGN / RMN) Staff Nurse (RGN / RMN)) HAMILTON CROSS Agency Staff Nurse (s) (RGN / RMN) regularly earn in excess of ㏒1,000 per week undertaking flexible shifts that suit them. ㏒19.00 - ㏒40.00 per hour (paid weekly). Flexible work for Staff Nurse - RGN / RMN, full or part time roles, work when you want to work, DAYS or NIGHTS DRIVERS/CAR＃","https://www.adzuna.co.uk/jobs/land/ad/1799661398?se=gkLvVr076xGf5tUtexr6aQ&utm_medium=api&utm_source=f0c87e31&v=4079681AE8CE9BD66C871D3476B62E9AEEA76F52",53.383801,-2.3547,76800,"0","1799661398",36480,"eyJhbGciOiJIUzI1NiJ9.eyJpIjoiMTc5OTY2MTM5OCIsInMiOiJna0x2VnIwNzZ4R2Y1dFV0ZXhyNmFRIn0.BeTtJ861Mt1mdOOmUh6udvo2ICN9wq01Wi7lAkbxoKA","2020-11-03T01:40:58Z","Adzuna::API::Response::Job",NA,NA,"Adzuna::API::Response::Category","Healthcare & Nursing Jobs","healthcare-nursing-jobs","Adzuna::API::Response::Company","Hamilton Cross","Altrincham, Greater Manchester","Adzuna::API::Response::Location","c(""UK"", ""North West England"", ""Greater Manchester"", ""Altrincham"")"
"10","Registered Nurse","About The Role Bank Nurse Paid PVG Check. We are looking for a passionate and caring individual with a proven ability to lead, motivate and mentor a team. Our main aim is to help our residents maintain their dignity and independence in our homely surrounding. As a Nurse at HC One, you＊ll value kindness above all. Because it drives every aspect of our Dementia, Nursing, Residential and Specialist care homes. Every single person who works here understands that our residents are people just like t＃","https://www.adzuna.co.uk/jobs/land/ad/1833605506?se=gkLvVr076xGf5tUtexr6aQ&utm_medium=api&utm_source=f0c87e31&v=1F60094A840A2783D3EAE5C4ECA5AE5BDF90D0EF",56.1194,-3.93588,30720,"0","1833605506",30720,"eyJhbGciOiJIUzI1NiJ9.eyJzIjoiZ2tMdlZyMDc2eEdmNXRVdGV4cjZhUSIsImkiOiIxODMzNjA1NTA2In0.YIAt6yKRfiZM7Km8vlI2QZ1VpF9hoojAvqqnbpJoSoo","2020-11-19T18:04:38Z","Adzuna::API::Response::Job",NA,NA,"Adzuna::API::Response::Category","Healthcare & Nursing Jobs","healthcare-nursing-jobs","Adzuna::API::Response::Company","HC One Limited","Stirling, County Stirling","Adzuna::API::Response::Location","c(""UK"", ""Scotland"", ""County Stirling"", ""Stirling"")"
"11","Disability Assessor","Are you an experienced Healthcare Professional looking for a fresh career challenge and an opportunity to develop your clinical skills? We are looking for qualified Physiotherapists, Occupational Therapists, Paramedics and Nurses with clinical knowledge and experience for an exciting new role when you are ready for a change, right now or in the near future. In this varied role as a Disability Assessor you will: Speak to people with a wide range of conditions and disabilities via telephone consu＃","https://www.adzuna.co.uk/jobs/land/ad/1855387574?se=gkLvVr076xGf5tUtexr6aQ&utm_medium=api&utm_source=f0c87e31&v=39C2A939EE1A3999802224612A916E529EC89D57",51.443901,0.219727,41000,"0","1855387574",0,"eyJhbGciOiJIUzI1NiJ9.eyJpIjoiMTg1NTM4NzU3NCIsInMiOiJna0x2VnIwNzZ4R2Y1dFV0ZXhyNmFRIn0.h1mSYGbdeRl-YltekEM9vbm0FCDxbVVSA9IzJClSfn4","2020-12-01T20:13:26Z","Adzuna::API::Response::Job",NA,NA,"Adzuna::API::Response::Category","Healthcare & Nursing Jobs","healthcare-nursing-jobs","Adzuna::API::Response::Company","SJB Medical","Dartford, Kent","Adzuna::API::Response::Location","c(""UK"", ""South East England"", ""Kent"", ""Dartford"")"
"12","Registered Nurse - The Polegate Nursing Centre","Registered Nurse- Days The Polegate- Blackpath, Polegate, East Sussex, BN26 5AP We are looking for a passionate and caring individual with a proven ability to lead, motivate and mentor a team. Our main aim is to help our residents maintain their dignity and independence in our homely surrounding. About the role As a Nurse at HC One, you＊ll value kindness above all. Because it drives every aspect of our Dementia, Nursing, Residential and Specialist care homes. Every single person who works here ＃","https://www.adzuna.co.uk/jobs/land/ad/1835966724?se=gkLvVr076xGf5tUtexr6aQ&utm_medium=api&utm_source=f0c87e31&v=A863D6D6D3682682E296A049151609ED18D072F0",50.830799,0.25319,16,"0","1835966724",16,"eyJhbGciOiJIUzI1NiJ9.eyJpIjoiMTgzNTk2NjcyNCIsInMiOiJna0x2VnIwNzZ4R2Y1dFV0ZXhyNmFRIn0.ZoGxOELiFxiLTpHJwgaxIdc7rH7X7YMIPxX_XBKOip4","2020-11-21T00:26:48Z","Adzuna::API::Response::Job",NA,NA,"Adzuna::API::Response::Category","Healthcare & Nursing Jobs","healthcare-nursing-jobs","Adzuna::API::Response::Company","HC One Limited","Polegate, East Sussex","Adzuna::API::Response::Location","c(""UK"", ""South East England"", ""East Sussex"", ""Polegate"")"
"13","Software Developer","The ideal candidate for the role will have several years＊ experience developing web applications in a cloud environment such as AWS, GCP, or Azure. We are looking for the top talent in the industry, highly skilled in defining application architectures, building APIs, and automating every aspect of a modern software system. Responsibilities : Create well-designed, documented, and tested software features that meet customer requirements. Identify and address product bugs, deficiencies, and perfor＃","https://www.adzuna.co.uk/jobs/land/ad/1831377850?se=gkLvVr076xGf5tUtexr6aQ&utm_medium=api&utm_source=f0c87e31&v=2730E74753DCE1E4113FCFFA07C337A121259729",51.377998,0.0192,58033.34,"1","1831377850",58033.34,"eyJhbGciOiJIUzI1NiJ9.eyJzIjoiZ2tMdlZyMDc2eEdmNXRVdGV4cjZhUSIsImkiOiIxODMxMzc3ODUwIn0.Ork7ljdZud4uyapPzYeoelPYrJ_KQs9i1uymDtfHjuw","2020-11-18T22:15:53Z","Adzuna::API::Response::Job",NA,NA,"Adzuna::API::Response::Category","IT Jobs","it-jobs","Adzuna::API::Response::Company","Rackspace","Hayes, Bromley","Adzuna::API::Response::Location","c(""UK"", ""London"", ""South East London"", ""Bromley"", ""Hayes"")"
"14","Residential Home Deputy Manager","Manchester Deputy Home Manager (Children's Residential) Salary: ㏒27,104.00 - ㏒29,903.00 based on a full-time Deputy Home Manager, working 169 hours per month (39 per week) and completing 8 ＆sleep-ins＊ per month (paid at ㏒7.83 per hour for 8 hours - each 'sleep-in' is paid at ㏒62.64) The Keys Group are the second largest provider of residential child care in the UK, with 87% of our services rated by OFSTED as 'Good' or 'Outstanding'. Our EPIC values (excellence. passion. integrity. caring) under＃","https://www.adzuna.co.uk/jobs/land/ad/1801202309?se=gkLvVr076xGf5tUtexr6aQ&utm_medium=api&utm_source=f0c87e31&v=2C4CA21EC143804D072D2B514C91B337DF40BA2D",53.480701,-2.23438,29903,"0","1801202309",27104,"eyJhbGciOiJIUzI1NiJ9.eyJpIjoiMTgwMTIwMjMwOSIsInMiOiJna0x2VnIwNzZ4R2Y1dFV0ZXhyNmFRIn0.8Wes1lxWk2RluJDI4RNcbct8FkKh2CLooNoQ6AIclBE","2020-11-03T22:05:03Z","Adzuna::API::Response::Job",NA,NA,"Adzuna::API::Response::Category","Social work Jobs","social-work-jobs","Adzuna::API::Response::Company","Keys Group Ltd","Manchester, Greater Manchester","Adzuna::API::Response::Location","c(""UK"", ""North West England"", ""Greater Manchester"", ""Manchester"")"
"15","DevOps Engineer x 2 - London Manchester Bristol","A new year - a new challenge? We are a multi-award winning digital agency with 3000 talented people in 45 beautiful offices across 16 countries. We work with some of the world＊s best known brands, from airlines and travel companies, to the leading retailers, luxury brands and automotive and B2B companies. We also have a lasting legacy with the UK Government built over 25 years of transforming the user experience to improve lives. So, whether you are renewing a Blue Badge, booking your next holi＃","https://www.adzuna.co.uk/jobs/land/ad/1857408202?se=gkLvVr076xGf5tUtexr6aQ&utm_medium=api&utm_source=f0c87e31&v=F0409B1DEEF044E23A9CAAC06C8A037AC522E113",51.586237,-0.123313,47022.14,"1","1857408202",47022.14,"eyJhbGciOiJIUzI1NiJ9.eyJzIjoiZ2tMdlZyMDc2eEdmNXRVdGV4cjZhUSIsImkiOiIxODU3NDA4MjAyIn0.4o-CA31iikI1xpLFzLOQ485Al1-_fEBrUqcK4wahGUc","2020-12-02T16:18:21Z","Adzuna::API::Response::Job",NA,NA,"Adzuna::API::Response::Category","IT Jobs","it-jobs","Adzuna::API::Response::Company","Valtech Limited","North London, London","Adzuna::API::Response::Location","c(""UK"", ""London"", ""North London"")"
"16","Staff Nurse","Staff Nurse Solihull - Brand New Nursing Home ㏒34000  Excellent Staff Benefits I currently have an exciting opportunity for a Staff Nurse (RGN/RMN) to work for a highly regarded, employee focused care provider within their beautiful, new care service in Solihull. The home provides specialist elderly care and general nursing care. As the Staff Nurse you will be provide high quality, person-centred care within the homes 20 bedded nursing unit. As the Staff Nurse you will be entitled to a range of＃","https://www.adzuna.co.uk/jobs/land/ad/1873405956?se=gkLvVr076xGf5tUtexr6aQ&utm_medium=api&utm_source=f0c87e31&v=945F704080D6C3A50441B07FEA265A20C346ED4F",52.4147,-1.7743,49920,"0","1873405956",32640,"eyJhbGciOiJIUzI1NiJ9.eyJzIjoiZ2tMdlZyMDc2eEdmNXRVdGV4cjZhUSIsImkiOiIxODczNDA1OTU2In0.j6HvQMbO3-rmyQtAnw5g6M-8nn7N9ejxVmhdjOu6XHY","2020-12-10T14:20:17Z","Adzuna::API::Response::Job",NA,NA,"Adzuna::API::Response::Category","Healthcare & Nursing Jobs","healthcare-nursing-jobs","Adzuna::API::Response::Company","WR Health","Solihull, West Midlands","Adzuna::API::Response::Location","c(""UK"", ""West Midlands"", ""Solihull"")"
"17","Band 5 Nurse","Are you a registered general nurse with a minimum of six months post registration experience? Would you like the luxury of working around other commitments whilst earning an impressive hourly rate? What can you expect? Working for Poppy offers you the flexibility to work around your lifestyle, while our smartphone app will allow you to book shifts at ease. As well as competitive pay, with bonuses and incentives you＊ll benefit from being a part of a team that you can be proud of, and that is wel＃","https://www.adzuna.co.uk/jobs/land/ad/1812123427?se=gkLvVr076xGf5tUtexr6aQ&utm_medium=api&utm_source=f0c87e31&v=762D214080E6591EBC75C8A06A6452A76693216D",51.790901,1.15623,96000,"0","1812123427",48000,"eyJhbGciOiJIUzI1NiJ9.eyJzIjoiZ2tMdlZyMDc2eEdmNXRVdGV4cjZhUSIsImkiOiIxODEyMTIzNDI3In0.1gHVZCHIVTqzZrN4Gg8YDLetRLTkDKmneB5sTr42gC4","2020-11-09T18:05:00Z","Adzuna::API::Response::Job",NA,NA,"Adzuna::API::Response::Category","Healthcare & Nursing Jobs","healthcare-nursing-jobs","Adzuna::API::Response::Company","Poppy Nursing Services","Clacton-On-Sea, Essex","Adzuna::API::Response::Location","c(""UK"", ""Eastern England"", ""Essex"", ""Clacton-On-Sea"")"
"18","Senior Backend Software Engineer - Be part of something special.","D o you want to be part of something special? Do you want to be part of a greenfield project that is taking off? Do you want use Using Bleeding edge Technologies? FinTech is recognised as the fastest growing area of technology in the UK. As a hub of global finance there are great opportunities for innovative businesses in this space to grow more quickly than in any other industry. Do you want to be part of a greenfield project that is taking off, working with Quant developers to build a product＃","https://www.adzuna.co.uk/jobs/land/ad/1873405944?se=gkLvVr076xGf5tUtexr6aQ&utm_medium=api&utm_source=f0c87e31&v=98DE8ACD95BC50E62B71A9E1B58B352B88D7272D",NA,NA,60000,"0","1873405944",60000,"eyJhbGciOiJIUzI1NiJ9.eyJzIjoiZ2tMdlZyMDc2eEdmNXRVdGV4cjZhUSIsImkiOiIxODczNDA1OTQ0In0.0WKacGVOxxd1J6rT4bsn0oFC6Ss-dDqNE-b0w4-Lz9w","2020-12-10T14:20:17Z","Adzuna::API::Response::Job",NA,NA,"Adzuna::API::Response::Category","IT Jobs","it-jobs","Adzuna::API::Response::Company","Evolution Recruitment Solutions Ltd","UK","Adzuna::API::Response::Location","UK"
"19","Community Care Worker","Nursesplus are looking for Community Care Workers to provide person centred care to service users in Folkestone and surrounding areas. You will be providing care in people's homes assisting our service users to live full, interesting lives but still staying within the comfort of their own home. You will assist service users with their general health, personal care, medications, daily activities and leading a more fulfilled life. Minimum requirements to work with Nurseplus as a Community Care Wo＃","https://www.adzuna.co.uk/jobs/land/ad/1746753367?se=gkLvVr076xGf5tUtexr6aQ&utm_medium=api&utm_source=f0c87e31&v=B2158DBBE175C11E2F38E0AC70D63DF6C1CAAA37",51.078701,1.17409,21408,"0","1746753367",18144,"eyJhbGciOiJIUzI1NiJ9.eyJpIjoiMTc0Njc1MzM2NyIsInMiOiJna0x2VnIwNzZ4R2Y1dFV0ZXhyNmFRIn0.q3HVW6cbmiWnlQK82uvkKLnD38B9a5MIagAwbgU6Y5w","2020-10-07T02:35:41Z","Adzuna::API::Response::Job",NA,NA,"Adzuna::API::Response::Category","Healthcare & Nursing Jobs","healthcare-nursing-jobs","Adzuna::API::Response::Company","Nurse Plus","Folkestone, Kent","Adzuna::API::Response::Location","c(""UK"", ""South East England"", ""Kent"", ""Folkestone"")"
"20","Bookkeeper / Cloud Accounting Specialist","Are you a systems whizz with an interest in all things cloud based? Do you have a strong background in bookkeeping and the ability to explain technical financial concepts in layman＊s terms? This role could be just up your alley I'm working with a very successful firm of accountants who need to strengthen their busy team, both from a bookkeeping and cloud accounting perspective, hence this role has been newly created. Your duties in this role will include management accounting, VAT and bookkeepi＃","https://www.adzuna.co.uk/jobs/land/ad/1802826840?se=gkLvVr076xGf5tUtexr6aQ&utm_medium=api&utm_source=f0c87e31&v=AEB163134336DDE9A422F5CA09DA8B468F4D0129",51.455299,-2.5919,23000,"0","1802826840",18000,"eyJhbGciOiJIUzI1NiJ9.eyJpIjoiMTgwMjgyNjg0MCIsInMiOiJna0x2VnIwNzZ4R2Y1dFV0ZXhyNmFRIn0.1FbucOsKgDaltddVmvfUzO7AsqDDK9kYC1JKbFFj-uI","2020-11-04T17:54:22Z","Adzuna::API::Response::Job",NA,NA,"Adzuna::API::Response::Category","Accounting & Finance Jobs","accounting-finance-jobs","Adzuna::API::Response::Company","Trial Balance Consulting","Bristol, South West England","Adzuna::API::Response::Location","c(""UK"", ""South West England"", ""Bristol"")"
"21","Bike Courier"," Bike Courier   Get a taste of freedom on the road with the UK's largest food delivery network.   Become a self-employed Bike Courier and discover a feast of flexible opportunities at Just Eat.   Whether you're a student trying to make some extra cash, or have a bicycle and are looking to get on the road, this is a great opportunity for you to boost your income (and work on your calf muscles too). You can work weekdays or weekends, daytime or evenings, a full schedule or bits here and there - t＃","https://www.adzuna.co.uk/jobs/land/ad/1199096377?se=gkLvVr076xGf5tUtexr6aQ&utm_medium=api&utm_source=f0c87e31&v=CC48D8EB9B0F8AEDD818142AD18E10F2B2C9104B",57.147499,-2.0954,30236.34,"1","1199096377",30236.34,"eyJhbGciOiJIUzI1NiJ9.eyJzIjoiZ2tMdlZyMDc2eEdmNXRVdGV4cjZhUSIsImkiOiIxMTk5MDk2Mzc3In0.eaaa4vPEIO3qfnRNdjSrTrwtHe3ZK9lcU4QIVbBm9rk","2019-07-04T10:57:49Z","Adzuna::API::Response::Job","contract","part_time","Adzuna::API::Response::Category","Other/General Jobs","other-general-jobs","Adzuna::API::Response::Company","Just Eat","Aberdeen, Aberdeenshire","Adzuna::API::Response::Location","c(""UK"", ""Scotland"", ""Aberdeenshire"", ""Aberdeen"")"
