"","title","description","redirect_url","latitude","longitude","salary_max","salary_is_predicted","id","salary_min","adref","created","__CLASS__","contract_type","contract_time","__CLASS__","label","tag","__CLASS__","display_name","display_name","__CLASS__","area"
"415","CARRELLISTI","FILIALE : UDINE ricerchiamo per azienda cliente settore logistica e trasporti CARRELLISTI da inserire all'interno di azienda metalmeccanica, che si occupino della movimentazione fino a 20 tonnellate, disponibili a 3 turni e ciclo continuo. Contratto a tempo determinato in somministrazione, scopo assunzione. Gi Group SpA 豕 autorizzata ad operare dal Ministero del Lavoro (Aut. Min. 26/11/2004 PROT. 1101 - SG). I candidati ambosessi ( n. 198/2006) sono invitati a leggere l＊informativa privacy ai s＃","https://www.adzuna.it/land/ad/1842900574?se=So_Pdb076xGLEAVZenzCdg&utm_medium=api&utm_source=f0c87e31&v=B2D9DE2A547E70D65714BA1B063BA9A8161E025D",45.883588,13.284748,NA,"0","1842900574",NA,"eyJhbGciOiJIUzI1NiJ9.eyJpIjoiMTg0MjkwMDU3NCIsInMiOiJTb19QZGIwNzZ4R0xFQVZaZW56Q2RnIn0.r83Bxyw0DU4PO02J3a1SDo2LAXFRndpSBdcDnyuOEuw","2020-11-25T01:39:39Z","Adzuna::API::Response::Job","contract",NA,"Adzuna::API::Response::Category","Produzione/Industrie Manifatturiere","manufacturing-jobs","Adzuna::API::Response::Company","Gi Group","Bagnaria Arsa, Provincia di Udine","Adzuna::API::Response::Location","c(""Italia"", ""Friuli-Venezia Giulia"", ""Provincia di Udine"", ""Bagnaria Arsa"")"
"416","Sei un'impresa di pulizie? Antonella L. ha richiesto sanificazione ambientale","Antonella L. ha fatto richiesta per impresa di pulizie a Cosenza. Prontopro 豕 il portale leader dei servizi che ti mette in contatto con nuovi clienti senza intermediari e abbonamenti. Di seguito una richiesta di lavoro arrivata sulla nostra piattaforma da parte di un utente. Clicca sul link sotto per iscriverti gratis a Prontopro e rispondere subito alla richiesta","https://www.adzuna.it/land/ad/1846007620?se=So_Pdb076xGLEAVZenzCdg&utm_medium=api&utm_source=f0c87e31&v=54631DC949AB91E056EF95ACDD8D35025A0B7A83",39.261404,16.297553,NA,"0","1846007620",NA,"eyJhbGciOiJIUzI1NiJ9.eyJzIjoiU29fUGRiMDc2eEdMRUFWWmVuekNkZyIsImkiOiIxODQ2MDA3NjIwIn0._3fr8Ahugynk05hP4L9sA2eJ3jjezsWHUNOCwvrgEsg","2020-11-26T16:13:37Z","Adzuna::API::Response::Job","contract","part_time","Adzuna::API::Response::Category","Lavori domestici/Pulizie/Babysitter","domestic-help-cleaning-jobs","Adzuna::API::Response::Company",NA,"Cosenza, Provincia di Cosenza","Adzuna::API::Response::Location","c(""Italia"", ""Calabria"", ""Provincia di Cosenza"", ""Cosenza"")"
"417","Sei un verniciatore? Leone F. ha richiesto verniciatura","Leone F. ha fatto richiesta per verniciatura a Lecce. Prontopro 豕 il portale leader dei servizi che ti mette in contatto con nuovi clienti senza intermediari e abbonamenti. Di seguito una richiesta di lavoro arrivata sulla nostra piattaforma da parte di un utente. Clicca sul link sotto per iscriverti gratis a Prontopro e rispondere subito alla richiesta","https://www.adzuna.it/land/ad/1846053067?se=So_Pdb076xGLEAVZenzCdg&utm_medium=api&utm_source=f0c87e31&v=0274B9CCFE618A4DFCD89C9E9AF226D9147F56CC",40.32878,18.16602,NA,"0","1846053067",NA,"eyJhbGciOiJIUzI1NiJ9.eyJpIjoiMTg0NjA1MzA2NyIsInMiOiJTb19QZGIwNzZ4R0xFQVZaZW56Q2RnIn0.jbDg4XHbTFbVEIf_z8-LTMIvN3tfAjzx1LN6UMCOjKE","2020-11-26T16:17:31Z","Adzuna::API::Response::Job","contract","part_time","Adzuna::API::Response::Category","Grafica/Creativit角/Design","creative-design-jobs","Adzuna::API::Response::Company",NA,"San Cesario di Lecce, Provincia di Lecce","Adzuna::API::Response::Location","c(""Italia"", ""Puglia"", ""Provincia di Lecce"", ""San Cesario di Lecce"")"
"418","Sei un ristrutturatore? Antonio D. ha richiesto ristrutturazione casa","Antonio D. ha fatto richiesta per grandi ristrutturazioni a Avellino. Prontopro 豕 il portale leader dei servizi che ti mette in contatto con nuovi clienti senza intermediari e abbonamenti. Di seguito una richiesta di lavoro arrivata sulla nostra piattaforma da parte di un utente. Clicca sul link sotto per iscriverti gratis a Prontopro e rispondere subito alla richiesta","https://www.adzuna.it/land/ad/1846055757?se=So_Pdb076xGLEAVZenzCdg&utm_medium=api&utm_source=f0c87e31&v=318C5B764FACD597EC4D3A8169D3624C23C5F153",40.853555,14.863361,NA,"0","1846055757",NA,"eyJhbGciOiJIUzI1NiJ9.eyJzIjoiU29fUGRiMDc2eEdMRUFWWmVuekNkZyIsImkiOiIxODQ2MDU1NzU3In0.o2Y5p8A2ID8CX_gOpcdS4lODeabtHzDcX7P2Pk0aGxI","2020-11-26T16:17:49Z","Adzuna::API::Response::Job","contract","part_time","Adzuna::API::Response::Category","Edilizia","trade-construction-jobs","Adzuna::API::Response::Company",NA,"Serino, Provincia di Avellino","Adzuna::API::Response::Location","c(""Italia"", ""Campania"", ""Provincia di Avellino"", ""Serino"")"
"419","Sei un serramentista? Alain A. ha richiesto installazione o sostituzione finestre","Alain A. ha fatto richiesta per infissi e serramenti a Savona. Prontopro 豕 il portale leader dei servizi che ti mette in contatto con nuovi clienti senza intermediari e abbonamenti. Di seguito una richiesta di lavoro arrivata sulla nostra piattaforma da parte di un utente. Clicca sul link sotto per iscriverti gratis a Prontopro e rispondere subito alla richiesta","https://www.adzuna.it/land/ad/1846014700?se=So_Pdb076xGLEAVZenzCdg&utm_medium=api&utm_source=f0c87e31&v=90EC63DBD205F96F03016FE9ACB39A1CA813D6E6",44.128841,8.25999,NA,"0","1846014700",NA,"eyJhbGciOiJIUzI1NiJ9.eyJzIjoiU29fUGRiMDc2eEdMRUFWWmVuekNkZyIsImkiOiIxODQ2MDE0NzAwIn0.S75T1wef6FMuvPHjhcHWB7f7hahKf5dnGDVu9OCtgto","2020-11-26T17:14:12Z","Adzuna::API::Response::Job","contract","part_time","Adzuna::API::Response::Category","Elettrotecnica/Metalmeccanico","maintenance-jobs","Adzuna::API::Response::Company",NA,"Loano, Provincia di Savona","Adzuna::API::Response::Location","c(""Italia"", ""Liguria"", ""Provincia di Savona"", ""Loano"")"
"420","Sei un meccanico? Bruno T. ha richiesto meccanico auto","Bruno T. ha fatto richiesta per meccanico auto a Ferrara. Prontopro 豕 il portale leader dei servizi che ti mette in contatto con nuovi clienti senza intermediari e abbonamenti. Di seguito una richiesta di lavoro arrivata sulla nostra piattaforma da parte di un utente. Clicca sul link sotto per iscriverti gratis a Prontopro e rispondere subito alla richiesta","https://www.adzuna.it/land/ad/1846000388?se=So_Pdb076xGLEAVZenzCdg&utm_medium=api&utm_source=f0c87e31&v=D19458EE9A0A3A9C38D5F1575AFD561BDBD2F85D",44.779461,11.30517,NA,"0","1846000388",NA,"eyJhbGciOiJIUzI1NiJ9.eyJpIjoiMTg0NjAwMDM4OCIsInMiOiJTb19QZGIwNzZ4R0xFQVZaZW56Q2RnIn0.niHWHidslt9u5UohcX-Ouq1IVxlyc5Y5_9oEJ5RcfCc","2020-11-26T16:13:09Z","Adzuna::API::Response::Job","contract","part_time","Adzuna::API::Response::Category","Elettrotecnica/Metalmeccanico","maintenance-jobs","Adzuna::API::Response::Company",NA,"Cento, Provincia di Ferrara","Adzuna::API::Response::Location","c(""Italia"", ""Emilia-Romagna"", ""Provincia di Ferrara"", ""Cento"")"
"421","Sei un muratore? Caputi I. ha richiesto riparazioni muri e muratura","Caputi I. ha fatto richiesta per muratori e opere murarie a Torino. Prontopro 豕 il portale leader dei servizi che ti mette in contatto con nuovi clienti senza intermediari e abbonamenti. Di seguito una richiesta di lavoro arrivata sulla nostra piattaforma da parte di un utente. Clicca sul link sotto per iscriverti gratis a Prontopro e rispondere subito alla richiesta","https://www.adzuna.it/land/ad/1846053084?se=So_Pdb076xGLEAVZenzCdg&utm_medium=api&utm_source=f0c87e31&v=94DD16DEA4204BF968D91ACEEC093EBFDDE065BD",45.022809,7.587822,NA,"0","1846053084",NA,"eyJhbGciOiJIUzI1NiJ9.eyJpIjoiMTg0NjA1MzA4NCIsInMiOiJTb19QZGIwNzZ4R0xFQVZaZW56Q2RnIn0.9YMVaEHua2JiWUkgilITk4eU5GP4E6K1dByXqvQhhE8","2020-11-26T16:17:32Z","Adzuna::API::Response::Job","contract","part_time","Adzuna::API::Response::Category","Edilizia","trade-construction-jobs","Adzuna::API::Response::Company",NA,"Beinasco, Provincia di Torino","Adzuna::API::Response::Location","c(""Italia"", ""Piemonte"", ""Provincia di Torino"", ""Beinasco"")"
"422","Sei un muratore? Sonia C. ha richiesto muratore","Sonia C. ha fatto richiesta per muratori e opere murarie a Terni. Prontopro 豕 il portale leader dei servizi che ti mette in contatto con nuovi clienti senza intermediari e abbonamenti. Di seguito una richiesta di lavoro arrivata sulla nostra piattaforma da parte di un utente. Clicca sul link sotto per iscriverti gratis a Prontopro e rispondere subito alla richiesta","https://www.adzuna.it/land/ad/1846059369?se=So_Pdb076xGLEAVZenzCdg&utm_medium=api&utm_source=f0c87e31&v=35858FBC525FD7B7349E0ED94210D2046449E112",42.5844,12.679877,NA,"0","1846059369",NA,"eyJhbGciOiJIUzI1NiJ9.eyJzIjoiU29fUGRiMDc2eEdMRUFWWmVuekNkZyIsImkiOiIxODQ2MDU5MzY5In0.d5AtSDwCxxNCOBOhWuys6tbZsiChmTJ1gBuqHAmii74","2020-11-26T16:18:15Z","Adzuna::API::Response::Job","contract","part_time","Adzuna::API::Response::Category","Edilizia","trade-construction-jobs","Adzuna::API::Response::Company",NA,"Terni, Provincia di Terni","Adzuna::API::Response::Location","c(""Italia"", ""Umbria"", ""Provincia di Terni"", ""Terni"")"
"423","Ripari elettrodomestici? Orsaria G. ha richiesto riparazione asciugatrice","Orsaria G. ha fatto richiesta per riparazione grandi elettrodomestici a Udine. Prontopro 豕 il portale leader dei servizi che ti mette in contatto con nuovi clienti senza intermediari e abbonamenti. Di seguito una richiesta di lavoro arrivata sulla nostra piattaforma da parte di un utente. Clicca sul link sotto per iscriverti gratis a Prontopro e rispondere subito alla richiesta","https://www.adzuna.it/land/ad/1845984706?se=So_Pdb076xGLEAVZenzCdg&utm_medium=api&utm_source=f0c87e31&v=42E59840ED85CC17575EF9B890789D88A156963F",46.064591,13.264129,NA,"0","1845984706",NA,"eyJhbGciOiJIUzI1NiJ9.eyJpIjoiMTg0NTk4NDcwNiIsInMiOiJTb19QZGIwNzZ4R0xFQVZaZW56Q2RnIn0.OB5q73QqDtx_tj_ZyirITqQTt4iFULi_WN1L1sLmqvo","2020-11-26T17:11:22Z","Adzuna::API::Response::Job","contract","part_time","Adzuna::API::Response::Category","Elettrotecnica/Metalmeccanico","maintenance-jobs","Adzuna::API::Response::Company",NA,"Udine, Provincia di Udine","Adzuna::API::Response::Location","c(""Italia"", ""Friuli-Venezia Giulia"", ""Provincia di Udine"", ""Udine"")"
"424","Sei un nutrizionista? Rachele D. ha richiesto consulente per l'alimentazione/nutrizionista","Rachele D. ha fatto richiesta per dieta a Arezzo. Prontopro 豕 il portale leader dei servizi che ti mette in contatto con nuovi clienti senza intermediari e abbonamenti. Di seguito una richiesta di lavoro arrivata sulla nostra piattaforma da parte di un utente. Clicca sul link sotto per iscriverti gratis a Prontopro e rispondere subito alla richiesta","https://www.adzuna.it/land/ad/1846036102?se=So_Pdb076xGLEAVZenzCdg&utm_medium=api&utm_source=f0c87e31&v=621ED1B921F4343915CCACC0ACD730ADFD89B340",43.494326,11.70502,NA,"0","1846036102",NA,"eyJhbGciOiJIUzI1NiJ9.eyJpIjoiMTg0NjAzNjEwMiIsInMiOiJTb19QZGIwNzZ4R0xFQVZaZW56Q2RnIn0.6JDN-czN0js2NZTYrFgnLdIyZhscyT5bawU8I2U5G0M","2020-11-26T16:16:04Z","Adzuna::API::Response::Job","contract","part_time","Adzuna::API::Response::Category","Consulenza","consultancy-jobs","Adzuna::API::Response::Company",NA,"Laterina, Provincia di Arezzo","Adzuna::API::Response::Location","c(""Italia"", ""Toscana"", ""Provincia di Arezzo"", ""Laterina"")"
"425","Sei un personal trainer? Andrea F. ha richiesto personal trainer","Andrea F. ha fatto richiesta per personal trainer a Mantova. Prontopro 豕 il portale leader dei servizi che ti mette in contatto con nuovi clienti senza intermediari e abbonamenti. Di seguito una richiesta di lavoro arrivata sulla nostra piattaforma da parte di un utente. Clicca sul link sotto per iscriverti gratis a Prontopro e rispondere subito alla richiesta","https://www.adzuna.it/land/ad/1846066829?se=So_Pdb076xGLEAVZenzCdg&utm_medium=api&utm_source=f0c87e31&v=D18B2ECBB0CB191827C5FCD84369E04652F05592",45.157793,10.835823,NA,"0","1846066829",NA,"eyJhbGciOiJIUzI1NiJ9.eyJzIjoiU29fUGRiMDc2eEdMRUFWWmVuekNkZyIsImkiOiIxODQ2MDY2ODI5In0.lroSUoqIlACCLSFCozLT0di2gZDQ84sHKBAOgxaECN8","2020-11-26T16:18:56Z","Adzuna::API::Response::Job","contract","part_time","Adzuna::API::Response::Category","Formazione/Istruzione","teaching-jobs","Adzuna::API::Response::Company",NA,"Mantova, Provincia di Mantova","Adzuna::API::Response::Location","c(""Italia"", ""Lombardia"", ""Provincia di Mantova"", ""Mantova"")"
"426","Sei un meccanico? Giorgio S. ha richiesto carrozziere auto","Giorgio S. ha fatto richiesta per carrozziere auto a Catanzaro. Prontopro 豕 il portale leader dei servizi che ti mette in contatto con nuovi clienti senza intermediari e abbonamenti. Di seguito una richiesta di lavoro arrivata sulla nostra piattaforma da parte di un utente. Clicca sul link sotto per iscriverti gratis a Prontopro e rispondere subito alla richiesta","https://www.adzuna.it/land/ad/1845986506?se=So_Pdb076xGLEAVZenzCdg&utm_medium=api&utm_source=f0c87e31&v=923D4A8B849E53CB7A26153EA5262E5D94646A72",38.910599,16.587679,NA,"0","1845986506",NA,"eyJhbGciOiJIUzI1NiJ9.eyJpIjoiMTg0NTk4NjUwNiIsInMiOiJTb19QZGIwNzZ4R0xFQVZaZW56Q2RnIn0.j3JCAhVnURpElbXoHIOB1lL0KFo1BohUivr1zssoV5w","2020-11-26T16:11:39Z","Adzuna::API::Response::Job","contract","part_time","Adzuna::API::Response::Category","Elettrotecnica/Metalmeccanico","maintenance-jobs","Adzuna::API::Response::Company",NA,"Catanzaro, Provincia di Catanzaro","Adzuna::API::Response::Location","c(""Italia"", ""Calabria"", ""Provincia di Catanzaro"", ""Catanzaro"")"
"427","Sei un costruttore di camini o stufe? Emanuele R. ha richiesto spazzacamino","Emanuele R. ha fatto richiesta per spazzacamino a Alessandria. Prontopro 豕 il portale leader dei servizi che ti mette in contatto con nuovi clienti senza intermediari e abbonamenti. Di seguito una richiesta di lavoro arrivata sulla nostra piattaforma da parte di un utente. Clicca sul link sotto per iscriverti gratis a Prontopro e rispondere subito alla richiesta","https://www.adzuna.it/land/ad/1845983874?se=So_Pdb076xGLEAVZenzCdg&utm_medium=api&utm_source=f0c87e31&v=7C9C53D5A5B0C0E62394700D727E8143C34393BD",44.703174,9.066029,NA,"0","1845983874",NA,"eyJhbGciOiJIUzI1NiJ9.eyJpIjoiMTg0NTk4Mzg3NCIsInMiOiJTb19QZGIwNzZ4R0xFQVZaZW56Q2RnIn0.qSZS0BLB6C7KVMMP07w8-_QzRTmTrO0s7ZvWV31BzvE","2020-11-26T16:11:18Z","Adzuna::API::Response::Job","contract","part_time","Adzuna::API::Response::Category","Lavori domestici/Pulizie/Babysitter","domestic-help-cleaning-jobs","Adzuna::API::Response::Company",NA,"Albera Ligure, Provincia di Alessandria","Adzuna::API::Response::Location","c(""Italia"", ""Piemonte"", ""Provincia di Alessandria"", ""Albera Ligure"")"
"428","BIM SPECIALIST","Selezioniamo per primaria Azienda cliente n∼1 BIM Specialist. Le risorse ideali sono in possesso di Diploma di geometra e hanno maturato esperienza come Disegnatori progettisti (geometri, ingegneri civili o architetti) nel campo delle infrastrutture stradali e/o ferroviarie e/o gallerie sotterranee con esperienza nel settore dei movimenti terra, delle opere di sostegno e dei cementi armati. Richiesta dimestichezza nell'utilizzo dei sistemi CAD (Computer Aided Design), che comprendono la creazio＃","https://www.adzuna.it/land/ad/1774505244?se=So_Pdb076xGLEAVZenzCdg&utm_medium=api&utm_source=f0c87e31&v=E74172744E8F6439262F9965B369A1C6DBA0C36B",45.404921,9.130413,NA,"0","1774505244",NA,"eyJhbGciOiJIUzI1NiJ9.eyJzIjoiU29fUGRiMDc2eEdMRUFWWmVuekNkZyIsImkiOiIxNzc0NTA1MjQ0In0.RxlWWlMFd0m6vB0hkOctdunnafXFm2syqxemW9x4vA8","2020-10-21T02:29:20Z","Adzuna::API::Response::Job","contract",NA,"Adzuna::API::Response::Category","Altro","other-general-jobs","Adzuna::API::Response::Company","ETJCA S.P.A.","Assago, Provincia di Milano","Adzuna::API::Response::Location","c(""Italia"", ""Lombardia"", ""Provincia di Milano"", ""Assago"")"
"429","MECCANICO / ELETTRAUTO","Mansione Randstad Italia, filiale di Manerbio, ricerca per importante realt角 della Bassa Bresciana un MECCANICO MEZZI PESANTI Il nostro cliente 豕 una realt角 solida e strutturata, alla ricerca di profili tecnici per ampliamento del proprio organico interno. Responsabilit角 La figura ricercata verr角 inserita all'interno dell'officina e si occuper角 delle seguenti mansioni: riparazioni e manutenzioni meccaniche montaggio meccanico e assemblaggio manutenzione del motore e di altri componenti, anche e＃","https://www.adzuna.it/land/ad/1862574374?se=So_Pdb076xGLEAVZenzCdg&utm_medium=api&utm_source=f0c87e31&v=A8AEC3E2A9E6D2196D971928E2058FB0475682F6",45.423913,10.107386,NA,"0","1862574374",NA,"eyJhbGciOiJIUzI1NiJ9.eyJpIjoiMTg2MjU3NDM3NCIsInMiOiJTb19QZGIwNzZ4R0xFQVZaZW56Q2RnIn0.bkw5XwiJIesj4OXTLUamrUlgOme4H0tZbfCy8fmsqb4","2020-12-05T01:42:46Z","Adzuna::API::Response::Job",NA,"full_time","Adzuna::API::Response::Category","Elettrotecnica/Metalmeccanico","maintenance-jobs","Adzuna::API::Response::Company","Randstad Italia","Dello, Provincia di Brescia","Adzuna::API::Response::Location","c(""Italia"", ""Lombardia"", ""Provincia di Brescia"", ""Dello"")"
"430","Sei un personal trainer? Andrea A. ha richiesto personal trainer","Andrea A. ha fatto richiesta per personal trainer a Milano. Prontopro 豕 il portale leader dei servizi che ti mette in contatto con nuovi clienti senza intermediari e abbonamenti. Di seguito una richiesta di lavoro arrivata sulla nostra piattaforma da parte di un utente. Clicca sul link sotto per iscriverti gratis a Prontopro e rispondere subito alla richiesta","https://www.adzuna.it/land/ad/1846067048?se=So_Pdb076xGLEAVZenzCdg&utm_medium=api&utm_source=f0c87e31&v=7F33C386DF7107456697464F11D4B1E14243F3E5",45.536908,9.055768,NA,"0","1846067048",NA,"eyJhbGciOiJIUzI1NiJ9.eyJzIjoiU29fUGRiMDc2eEdMRUFWWmVuekNkZyIsImkiOiIxODQ2MDY3MDQ4In0.i4qjr3kFttcBqlEp-nAVkU_vluXCbWl5C17u_RVAyds","2020-11-26T16:18:57Z","Adzuna::API::Response::Job","contract","part_time","Adzuna::API::Response::Category","Formazione/Istruzione","teaching-jobs","Adzuna::API::Response::Company",NA,"Rho, Provincia di Milano","Adzuna::API::Response::Location","c(""Italia"", ""Lombardia"", ""Provincia di Milano"", ""Rho"")"
"431","OPERAIO PER AZIENDA GALVANICA","SAPIENS SPA - filiale di Crema, ricerca per azienda cliente operante nel settore dei trattamenti galvanici, un addetto/a alla galvanica.La Risorsa si occuper角 di trattamenti galvanici, carico e scarico telai. Preferibile precedente esperienza nella mansione.Luogo di lavoro: Vicinanze Crema (CR) Orario di lavoro: Full-time su giornata.Per info e candidature: 0373/202650La ricerca 豕 effettuata da Sapiens Spa Agenzia per il Lavoro (Aut. Min. 07/08/2013 prot. ). E' effettuata in conformit角 alle nor＃","https://www.adzuna.it/land/ad/1856155215?se=So_Pdb076xGLEAVZenzCdg&utm_medium=api&utm_source=f0c87e31&v=654EEF258030D3DE51DCBAA1E6566487EF53B484",45.361839,9.683226,NA,"0","1856155215",NA,"eyJhbGciOiJIUzI1NiJ9.eyJpIjoiMTg1NjE1NTIxNSIsInMiOiJTb19QZGIwNzZ4R0xFQVZaZW56Q2RnIn0.73sO_md5vHXvwZRsivGBlPD7vzcPnbLh5AzrJaU-6UU","2020-12-02T01:54:09Z","Adzuna::API::Response::Job","contract","full_time","Adzuna::API::Response::Category","Produzione/Industrie Manifatturiere","manufacturing-jobs","Adzuna::API::Response::Company","Sapiens SpA","Crema, Provincia di Cremona","Adzuna::API::Response::Location","c(""Italia"", ""Lombardia"", ""Provincia di Cremona"", ""Crema"")"
"432","Sei un serramentista? Guido C. ha richiesto installazione o sostituzione finestre","Guido C. ha fatto richiesta per infissi e serramenti a Napoli. Prontopro 豕 il portale leader dei servizi che ti mette in contatto con nuovi clienti senza intermediari e abbonamenti. Di seguito una richiesta di lavoro arrivata sulla nostra piattaforma da parte di un utente. Clicca sul link sotto per iscriverti gratis a Prontopro e rispondere subito alla richiesta","https://www.adzuna.it/land/ad/1846014059?se=So_Pdb076xGLEAVZenzCdg&utm_medium=api&utm_source=f0c87e31&v=E34045B1FCB436B3974ABE0ED9B358642133D379",40.645384,14.422524,NA,"0","1846014059",NA,"eyJhbGciOiJIUzI1NiJ9.eyJzIjoiU29fUGRiMDc2eEdMRUFWWmVuekNkZyIsImkiOiIxODQ2MDE0MDU5In0.1wdb_egv7Pamo0_H3ftQIa0IUj1TCLOaLo9pLV-oQ_g","2020-11-26T16:14:10Z","Adzuna::API::Response::Job","contract","part_time","Adzuna::API::Response::Category","Elettrotecnica/Metalmeccanico","maintenance-jobs","Adzuna::API::Response::Company",NA,"Meta, Provincia di Napoli","Adzuna::API::Response::Location","c(""Italia"", ""Campania"", ""Provincia di Napoli"", ""Meta"")"
"433","Sei un progettista? Manuel V. ha richiesto isolamento termico","Manuel V. ha fatto richiesta per ristrutturazione esterni a Padova. Prontopro 豕 il portale leader dei servizi che ti mette in contatto con nuovi clienti senza intermediari e abbonamenti. Di seguito una richiesta di lavoro arrivata sulla nostra piattaforma da parte di un utente. Clicca sul link sotto per iscriverti gratis a Prontopro e rispondere subito alla richiesta","https://www.adzuna.it/land/ad/1846058418?se=So_Pdb076xGLEAVZenzCdg&utm_medium=api&utm_source=f0c87e31&v=904472EF1B25ACBFF42736D9A3796487474623B4",45.103371,11.703052,NA,"0","1846058418",NA,"eyJhbGciOiJIUzI1NiJ9.eyJpIjoiMTg0NjA1ODQxOCIsInMiOiJTb19QZGIwNzZ4R0xFQVZaZW56Q2RnIn0.HYyL9SzqgPfuNLyh88ukvH0Vt4z4j2d_4OK4hqbkt5w","2020-11-26T16:18:09Z","Adzuna::API::Response::Job","contract","part_time","Adzuna::API::Response::Category","Elettrotecnica/Metalmeccanico","maintenance-jobs","Adzuna::API::Response::Company",NA,"Barbona, Provincia di Padova","Adzuna::API::Response::Location","c(""Italia"", ""Veneto"", ""Provincia di Padova"", ""Barbona"")"
"434","Sei un muratore o un piastrellista? Fabrizio M. ha richiesto posa o sostituzione pavimento calcestruzzo","Fabrizio M. ha fatto richiesta per pavimenti a Roma. Prontopro 豕 il portale leader dei servizi che ti mette in contatto con nuovi clienti senza intermediari e abbonamenti. Di seguito una richiesta di lavoro arrivata sulla nostra piattaforma da parte di un utente. Clicca sul link sotto per iscriverti gratis a Prontopro e rispondere subito alla richiesta","https://www.adzuna.it/land/ad/1846062872?se=So_Pdb076xGLEAVZenzCdg&utm_medium=api&utm_source=f0c87e31&v=37F5EFCA8B4E923BCDDAF5B0581393F48E46A55B",41.871582,12.23213,NA,"0","1846062872",NA,"eyJhbGciOiJIUzI1NiJ9.eyJzIjoiU29fUGRiMDc2eEdMRUFWWmVuekNkZyIsImkiOiIxODQ2MDYyODcyIn0.diHxzViHE-eebf_x3dHmQOVLvf9h5AkbxArm9navzNg","2020-11-26T16:18:34Z","Adzuna::API::Response::Job","contract","part_time","Adzuna::API::Response::Category","Edilizia","trade-construction-jobs","Adzuna::API::Response::Company",NA,"Fiumicino, Provincia di Roma","Adzuna::API::Response::Location","c(""Italia"", ""Lazio"", ""Provincia di Roma"", ""Fiumicino"")"
"435","PALCA 每 ADDETTO/A CONTROLLO QUALIT角 E GESTIONE RESI CAT. PROT. L. 68/99","Lavoropi迄 Spa, Ufficio Politiche Attive del Lavoro, Aut. Min 1104/SG del 26/11/2004, ricerca per azienda cliente un/una: Addetto/a Controllo Qualit角 e Gestione Resi appartenente alle categorie protette La risorsa si occuper角 di controllo qualit角 delle merci in entrata, controllo con utilizzo strumenti di misura, verifica del peso, dell＊imballo e delle etichette identificative, verifica del corretto montaggio e funzionamento di un prodotto, piccoli interventi di riparazione a banco sui prodotti,＃","https://www.adzuna.it/land/ad/1860495841?se=So_Pdb076xGLEAVZenzCdg&utm_medium=api&utm_source=f0c87e31&v=CC92C1B5255872B071D0BD72D27E7B4035A2792A",44.904262,10.556285,NA,"0","1860495841",NA,"eyJhbGciOiJIUzI1NiJ9.eyJzIjoiU29fUGRiMDc2eEdMRUFWWmVuekNkZyIsImkiOiIxODYwNDk1ODQxIn0.KAIjs5Rzaw0qIMVvc3lfXf-DE65KBJZWkGEsco__pJk","2020-12-04T02:16:15Z","Adzuna::API::Response::Job",NA,"full_time","Adzuna::API::Response::Category","Scienza","scientific-qa-jobs","Adzuna::API::Response::Company","LAVOROPIU' S.P.A. AGENZIA PER IL LAVORO","Boretto, Provincia di Reggio Emilia","Adzuna::API::Response::Location","c(""Italia"", ""Emilia-Romagna"", ""Provincia di Reggio Emilia"", ""Boretto"")"
"436","Sei un installatore di camini? Vitalino L. ha richiesto installazione o sostituzione stufe a pellet","Vitalino L. ha fatto richiesta per camini e stufe a Parma. Prontopro 豕 il portale leader dei servizi che ti mette in contatto con nuovi clienti senza intermediari e abbonamenti. Di seguito una richiesta di lavoro arrivata sulla nostra piattaforma da parte di un utente. Clicca sul link sotto per iscriverti gratis a Prontopro e rispondere subito alla richiesta","https://www.adzuna.it/land/ad/1846017767?se=So_Pdb076xGLEAVZenzCdg&utm_medium=api&utm_source=f0c87e31&v=5E662A9D53D22E120E76CC1B951F10D5F52DC7D5",44.725851,10.108679,NA,"0","1846017767",NA,"eyJhbGciOiJIUzI1NiJ9.eyJzIjoiU29fUGRiMDc2eEdMRUFWWmVuekNkZyIsImkiOiIxODQ2MDE3NzY3In0.7Rt5Hv7eZhBnaE78fUF-M5qnFlGH1JOP-3qf9lfmnZQ","2020-11-26T16:14:27Z","Adzuna::API::Response::Job","contract","part_time","Adzuna::API::Response::Category","Edilizia","trade-construction-jobs","Adzuna::API::Response::Company",NA,"Medesano, Provincia di Parma","Adzuna::API::Response::Location","c(""Italia"", ""Emilia-Romagna"", ""Provincia di Parma"", ""Medesano"")"
