"","title","description","redirect_url","latitude","longitude","salary_max","salary_is_predicted","id","salary_min","adref","created","__CLASS__","contract_type","contract_time","__CLASS__","label","tag","__CLASS__","display_name","display_name","__CLASS__","area"
"606","妊忌抉把投我抗/扯忘 扶忘 扭把抉忱批抗找抉志抑抄 扼抗抖忘忱","妓忘忌抉找忘 志忘抒找抉抄 扶忘 扭把抉我戒志抉忱扼找志快扶扶抉-扼抗抖忘忱扼抗抉技 抗抉技扭抖快抗扼快 扼 忌快扼扭抖忘找扶抑技 扭把抉忪我志忘扶我快技 我 忌快扼扭抖忘找扶抑技 扭我找忘扶我快技 抉找 扭把攸技抉忍抉 把忘忌抉找抉忱忘找快抖攸 圾抑 技抉忪快找快 扼志攸戒忘找抆扼攸 扼 扶忘扮我技 技快扶快忱忪快把抉技 我 戒忘扭我扼忘找抆扼攸 扶忘 扼抉忌快扼快忱抉志忘扶我快. 妙抑 扭把快忱抖忘忍忘快技: 圾抑扭抖忘找抑 扼把忘戒批 扭抉 抉抗抉扶折忘扶我我 志忘抒找抑 忌快戒 戒忘忱快把忪快抗 我 志抑折快找抉志\ 妝忘扼快抖快扶我快 志 忱快扶抆 抉扳抉把技抖快扶我攸; 坎快扼扭抖忘找扶抉快 扭把抉忪我志忘扶我快 志 抉忌投快忪我找我我; 坎快扼扭抖忘找扶抉快 扭我找忘扶我快; 坐把忘扳我抗 把忘忌抉找抑 6/1 抖我忌抉 7/0; 圾忘抒找忘 35/45/60 扼技快扶; 圻忪快扶快忱快抖抆扶抑抄 忘志忘扶扼 抉找 1500 把批忌; 妤把攸技抉抄 把忘忌抉找抉忱忘找快抖抆 妍忌攸戒忘扶扶抉扼找我: 孝扭忘抗抉志抗忘 忍抉找抉志抉抄 扭把抉忱批抗扯我我; 妞抉技扭抖快抗＃","https://www.adzuna.ru/land/ad/1832138261?se=gnH9fb076xGtuUivdyXBjA&utm_medium=api&utm_source=f0c87e31&v=5BF68CBBBE459B81D9730937DF4B946C440EB60A",55.78609,37.2074,696000,"0","1832138261",685200,"eyJhbGciOiJIUzI1NiJ9.eyJpIjoiMTgzMjEzODI2MSIsInMiOiJnbkg5ZmIwNzZ4R3R1VWl2ZHlYQmpBIn0.ZJONPOrXuoZzBtjQCitBzrBa6POJxBVOHhZXzsidCJU","2020-11-19T05:20:27Z","Adzuna::API::Response::Job",NA,NA,"Adzuna::API::Response::Category","Unknown","unknown","Adzuna::API::Response::Company","妍妍妍 妓抉技我","妙抉扼抗志忘, 妙抉扼抗抉志扼抗忘攸 抉忌抖忘扼找抆","Adzuna::API::Response::Location","c(""妓抉扼扼我攸"", ""妙抉扼抗抉志扼抗忘攸 抉忌抖忘扼找抆"", ""妙抉扼抗志忘"")"
"607","妥把忘抗找抉把我扼找","妍忌攸戒忘扶扶抉扼找我: <U+2022> 妙快抒忘扶我戒我把抉志忘扶扶忘攸 批忌抉把抗忘 扭把我抖快忍忘攻投快抄 找快把把我找抉把我我; <U+2022> 妓批折扶忘攸 批忌抉把抗忘 志 找把批忱扶抉忱抉扼找批扭扶抑抒 技快扼找忘抒; <U+2022> 妓忘忌抉找忘 扶忘 忌抉忌抗快找快 我 妙找戒 扶忘 戒忘抗把快扭抖快扶扶抉技 批折忘扼找抗快, 扭抉忱忱快把忪忘扶我快 折我扼找抉找抑; 妥把快忌抉志忘扶我攸: ; <U+2022> 妤把忘志忘 技忘扮我扶我扼找忘-找把忘抗找抉把我扼找忘 ; <U+2022> 妍找志快找扼找志快扶扶抉快 抉找扶抉扮快扶我快 抗 把忘忌抉找快; 孝扼抖抉志我攸: <U+2022> 坐把忘扳我抗 把忘忌抉找抑:6/1; <U+2022> 圾把快技攸 把忘忌抉找抑: 11 折忘扼抉志抉抄 把忘忌抉折我抄 忱快扶抆; <U+2022> 妝忘把忘忌抉找扶忘攸 扭抖忘找忘 37000 把批忌抖快抄 扶忘 把批抗我; <U+2022> 妊志抉快志把快技快扶扶抑快 志抑扭抖忘找抑 戒忘把忘忌抉找扶抉抄 扭抖忘找抑 2 把忘戒忘 志 技快扼攸扯; <U+2022> 妍扳抉把技抖快扶我快 扭抉 妥抗 妓扳. 妙快扼找抉 把忘忌抉找抑: 孝抖.妥快抖抆技忘扶忘 忱.24","https://www.adzuna.ru/land/ad/1778059833?se=gnH9fb076xGtuUivdyXBjA&utm_medium=api&utm_source=f0c87e31&v=B3B69C8B642C5BA75D7B619A2EF3987D404C4469",59.93904,30.31579,444000,"0","1778059833",444000,"eyJhbGciOiJIUzI1NiJ9.eyJpIjoiMTc3ODA1OTgzMyIsInMiOiJnbkg5ZmIwNzZ4R3R1VWl2ZHlYQmpBIn0.kXYKlv7D7lsDilBebknoHYUFEIo69kJmITQLkn02pF0","2020-10-22T21:08:42Z","Adzuna::API::Response::Job",NA,"full_time","Adzuna::API::Response::Category","Unknown","unknown","Adzuna::API::Response::Company","妒扶忱批扼找把我忘抖抆扶抑快 把快扮快扶我攸","妊忘扶抗找-妤快找快把忌批把忍, 妣快扶我扶忍把忘忱扼抗忘攸 抉忌抖忘扼找抆","Adzuna::API::Response::Location","c(""妓抉扼扼我攸"", ""妣快扶我扶忍把忘忱扼抗忘攸 抉忌抖忘扼找抆"", ""妊忘扶抗找-妤快找快把忌批把忍"")"
"608","妤把快忱扼找忘志我找快抖抆 妥我扶抆抗抉扳扳","妥我扶抆抗抉扳扳 〞 改找抉 找快抒扶抉抖抉忍我我, 抗忘折快扼找志快扶扶抑抄 扼快把志我扼 我 戒忘忌抉找忘 抉 扼抉找把批忱扶我抗忘抒. 妤把快忱扼找忘志我找快抖我 妥我扶抆抗抉扳扳 坎忘扶抗忘 志把批折忘攻找 抗抖我快扶找忘技 抗忘把找抑, 抗抉扶扼批抖抆找我把批攻找 抉 扭把抉忱批抗找忘抒 我 批扼抖批忍忘抒 忌忘扶抗忘. 妙抑 志扶我技忘找快抖抆扶抉 扼抖快忱我技 戒忘 忌快戒抉扭忘扼扶抉扼找抆攻 我 戒忱抉把抉志抆快技 扭把快忱扼找忘志我找快抖快抄 志 扭快把我抉忱 志扼扭抑扮抗我 志我把批扼忘. 妤抉改找抉技批 抗忘忪忱抑抄 扼抉找把批忱扶我抗 把快忍批抖攸把扶抉 扭抉抖批折忘快找 抉找 抗抉技扭忘扶我我 扼把快忱扼找志忘 我扶忱我志我忱批忘抖抆扶抉抄 戒忘投我找抑 (技忘扼抗我, 扭快把折忘找抗我, 扼忘扶我找忘抄戒快把抑) 我 忱抉抗批技快扶找抑, 把忘戒把快扮忘攻投我快 扭快把快忱志我忪快扶我快 扭抉 忍抉把抉忱批 我 戒忘 快忍抉 扭把快忱快抖忘技我. 完找抉 扶批忪扶抉 忱快抖忘找抆 坏抉扼找忘志抖攸找抆 抗抖我快扶找忘技 抗忘把找抑 忌忘扶抗忘 我 扭忘抗快＃","https://www.adzuna.ru/land/ad/1778053033?se=gnH9fb076xGtuUivdyXBjA&utm_medium=api&utm_source=f0c87e31&v=05C15963EFF0D4DD5046C0174671FE4D442F19BB",53.56519,49.30824,480000,"0","1778053033",480000,"eyJhbGciOiJIUzI1NiJ9.eyJpIjoiMTc3ODA1MzAzMyIsInMiOiJnbkg5ZmIwNzZ4R3R1VWl2ZHlYQmpBIn0.auAYiiIysBMu81nVwEpUD-JSip0v2jBco_hdPZzXsaU","2020-10-22T21:03:55Z","Adzuna::API::Response::Job",NA,"full_time","Adzuna::API::Response::Category","妥抉把忍抉志抖攸 我 扼忌抑找","sales-jobs","Adzuna::API::Response::Company","妥我扶抆抗抉扳扳","妥抉抖抆攸找找我, 妊忘技忘把扼抗忘攸 抉忌抖忘扼找抆","Adzuna::API::Response::Location","c(""妓抉扼扼我攸"", ""妊忘技忘把扼抗忘攸 抉忌抖忘扼找抆"", ""妥抉抖抆攸找找我"")"
"609","妊抖快扼忘把抆 均戒扼","妍忌攸戒忘扶扶抉扼找我: 妍忌扼抖批忪我志忘扶我快 我 把快技抉扶找 抉忌抉把批忱抉志忘扶我攸 均戒扼 妥把快忌抉志忘扶我攸: 孝技快扶我快 把忘忌抉找忘找抆 扼 把批折扶抑技 改抖快抗找把抉抉忌抉把批忱抉志忘扶我快技 妝扶忘扶我快 找快抒扶抉抖抉忍我我 均戒扼 孝技快扶我快 把忘忌抉找忘找抆 扼抉 扼抒快技忘技我 改抖快抗找把我折快扼抗我技我, 找快抒扶抉抖抉忍我折快扼抗我技我 孝扼抖抉志我攸: 坏抉扼找抉抄扶忘攸 戒忘把扭抖忘找忘. 妍扳我扯我忘抖抆扶抉快 找把批忱抉批扼找把抉抄扼找志抉. 妤把快技我我 我 忌抉扶批扼抑. 坏把批忪扶抑抄 抗抉抖抖快抗找我志. 妒扶抉忍抉把抉忱扶我技 扭把快忱抉扼找忘志抖攸快找扼攸 忪我抖抆快.","https://www.adzuna.ru/land/ad/1412843733?se=gnH9fb076xGtuUivdyXBjA&utm_medium=api&utm_source=f0c87e31&v=F58B7E0FD8F69CA8EBBB41D0978BD8A7013A5BF1",54.42273,50.78932,NA,"0","1412843733",NA,"eyJhbGciOiJIUzI1NiJ9.eyJpIjoiMTQxMjg0MzczMyIsInMiOiJnbkg5ZmIwNzZ4R3R1VWl2ZHlYQmpBIn0.QOmS4aTPGUK5NEG1m0A9x3HqIpm63hb_HfMScUhkvI4","2020-01-17T18:50:32Z","Adzuna::API::Response::Job",NA,NA,"Adzuna::API::Response::Category","Unknown","unknown","Adzuna::API::Response::Company","妍妍妍 妓抉扼扶快扳找快忍忘戒","妖批把抖忘找, 妥忘找忘把扼找忘扶","Adzuna::API::Response::Location","c(""妓抉扼扼我攸"", ""妥忘找忘把扼找忘扶"", ""妖批把抖忘找"")"
"610","妊扭快扯我忘抖我扼找 扭抉 扭把我志抖快折快扶我攻 抗抖我快扶找抉志 扼扭批找扶我抗抉志抉忍抉 妥志 ( 扼 妞我扶快抖抆-完快把抗忘扼扼抑)","妙找扼 每 抗把批扭扶快抄扮我抄 找快抖快抗抉技-忌把快扶忱 志 妓抉扼扼我我 我 妊扶忍, 扯我扳把抉志抉抄 抒抉抖忱我扶忍, 把忘戒志我志忘攻投我抄 忌抉抖快快 15 我扶扶抉志忘扯我抉扶扶抑抒 扶忘扭把忘志抖快扶我抄 每 抉找 我扶找快把扶快找忘 志快投快抄 我 抉忌把忘忌抉找抗我 忌抉抖抆扮我抒 忱忘扶扶抑抒 忱抉 抉扶抖忘抄扶-批扶我志快把扼我找快找忘 我 抗我忌快把扼扭抉把找忘. 妞抉技忘扶忱忘 坏快扭忘把找忘技快扶找忘 扭把抉忱忘忪 抉忌快扼扭快折我志忘快找 抗抖我快扶找抉志 抗忘折快扼找志快扶扶抑技我, 志抑忍抉忱扶抑技我 我 批忱抉忌扶抑技我 批扼抖批忍忘技我, 忘 找忘抗忪快 扭抉扼找抉攸扶扶抉 扼抉志快把扮快扶扼找志批快找 扼快把志我扼抑 我 抉找抗把抑志忘快找 忱抖攸 抗抖我快扶找抉志 忱志快把我 志 扯我扳把抉志抉快 忌批忱批投快快 妙抑 扼找忘抖我 忍批把批 扭把抉忱忘忪 我 忍抉找抉志抑 忱快抖我找抆扼攸 扼 找抉忌抉抄 改找我技 抉扭抑找抉技 每 志抑忌我把忘攸 把忘忌抉找批 批 扶忘扼, 找抑 扼找忘扶快扮抆 折忘扼找抆攻 抗抉技忘扶忱抑 扭把抉扳快＃","https://www.adzuna.ru/land/ad/1554070300?se=gnH9fb076xGtuUivdyXBjA&utm_medium=api&utm_source=f0c87e31&v=C3342016CD8CD596CC45CC96ACBE60A618B170AE",53.46947,51.47799,360000,"0","1554070300",360000,"eyJhbGciOiJIUzI1NiJ9.eyJzIjoiZ25IOWZiMDc2eEd0dVVpdmR5WEJqQSIsImkiOiIxNTU0MDcwMzAwIn0.cbFa0eWRJGwEpsjUV1sH5diaHkqudNTtxIiWC-SKMpU","2020-05-25T20:01:49Z","Adzuna::API::Response::Job",NA,"part_time","Adzuna::API::Response::Category","妥抉把忍抉志抖攸 我 扼忌抑找","sales-jobs","Adzuna::API::Response::Company","妙妥妊","妞我扶快抖抆, 妊忘技忘把扼抗忘攸 抉忌抖忘扼找抆","Adzuna::API::Response::Location","c(""妓抉扼扼我攸"", ""妊忘技忘把扼抗忘攸 抉忌抖忘扼找抆"", ""妞我扶快抖抆"")"
"611","妤抉志忘把-技批折扶我抗","妍忌攸戒忘扶扶抉扼找我: - 妤把我忍抉找抉志抖快扶我快 我戒忱快抖我抄 我戒 找快扼找忘; - 妊抉忌抖攻忱快扶我快 找快抒扶抉抖抉忍我我, 把快扯快扭找批把 扭把我忍抉找抉志抖快扶我攸, 抉扳抉把技抖快扶我攸 我 扭把忘志我抖 抒把忘扶快扶我攸. 妥把快忌抉志忘扶我攸: - 妍忌把忘戒抉志忘扶我快 扶快 扶我忪快 扼把快忱扶快-扼扭快扯我忘抖抆扶抉忍抉; - 妍扭抑找 把忘忌抉找抑 志 忘扶忘抖抉忍我折扶抉抄 忱抉抖忪扶抉扼找我 (扭抉志忘把-技批折扶我抗) 扶快 技快扶快快 1 (抉忱扶抉忍抉) 忍抉忱忘; - 妖忘抖我折我快 忱快抄扼找志批攻投快忍抉 技快忱. 抉扼技抉找把忘 (扭抉技抉投抆 志 抉扳抉把技抖快扶我我). 孝扼抖抉志我攸: - 妍扳抉把技抖快扶我快 扼抉忍抖忘扼扶抉 妥抗 妓扳; - 妒扼扭抑找忘找快抖抆扶抑抄 扼把抉抗 扼抉扼找忘志抖攸快找 3 技快扼攸扯忘; - 妤抉抖扶忘攸 扼抉扯我忘抖抆扶忘攸 戒忘投我投快扶扶抉扼找抆 (抉扭抖忘折我志忘快技抑快 忌抉抖抆扶我折扶抑快 我 抉找扭批扼抗忘); - 坐把忘扳我抗 把忘忌抉找抑: 2/2 扼 07.00-1＃","https://www.adzuna.ru/land/ad/1826863416?se=gnH9fb076xGtuUivdyXBjA&utm_medium=api&utm_source=f0c87e31&v=791C22F01D598EEF13924AC64DE83F832FBADC3D",55.79654,49.1082,324000,"0","1826863416",0,"eyJhbGciOiJIUzI1NiJ9.eyJzIjoiZ25IOWZiMDc2eEd0dVVpdmR5WEJqQSIsImkiOiIxODI2ODYzNDE2In0.pG0pK0VzvFHQJC-U0vBCcejaWJ4lMdq14ty-VxWI5_U","2020-11-16T21:41:32Z","Adzuna::API::Response::Job",NA,"part_time","Adzuna::API::Response::Category","坐抉扼找我扶我折扶抑抄 我 把快扼找抉把忘扶扶抑抄 忌我戒扶快扼","hospitality-catering-jobs","Adzuna::API::Response::Company","均妍 ""坏快扭忘把找忘技快扶找 扭把抉忱抉志抉抖抆扼找志我攸 我 扼抉扯我忘抖抆扶抉忍抉 扭我找忘扶我攸 忍. 妞忘戒忘扶我""","妞忘戒忘扶抆, 妥忘找忘把扼找忘扶","Adzuna::API::Response::Location","c(""妓抉扼扼我攸"", ""妥忘找忘把扼找忘扶"", ""妞忘戒忘扶抆"")"
"612","妍扭快把忘找抉把 抗抖我快扶找扼抗抉忍抉 扼快把志我扼忘","<U+00AB>妣快扶找忘<U+00BB> , 抉忱扶忘 我戒 抗把批扭扶快抄扮我抒 扳快忱快把忘抖抆扶抑抒 把抉戒扶我折扶抑抒 扼快找快抄 妓抉扼扼我我, 扭把我忍抖忘扮忘快找 扶忘 忱抉抖忪扶抉扼找抆 妞忘扼扼我把 / 妍扭快把忘找抉把 抗抖我快扶找扼抗抉忍抉 扼快把志我扼忘 扼批扭快把技忘把抗快找忘 圾 圾忘扮我 抉忌攸戒忘扶扶抉扼找我 忌批忱快找 志抒抉忱我找抆: 把忘忌抉找忘 扶忘 抗忘扼扼快 抗抉扶扼批抖抆找忘扯我攸 我 抉忌扼抖批忪我志忘扶我快 扭抉抗批扭忘找快抖快抄 志抑抗抖忘忱抗忘 找抉志忘把忘 志 扭把我抗忘扼扼抉志抉抄 戒抉扶快, 抗抉扶找把抉抖抆 扼把抉抗抉志 把快忘抖我戒忘扯我我, 把抉找忘扯我攸, 把忘忌抉找忘 扼 扯快扶扶我抗忘技我, 扭抉技抉投抆 志 找抉把忍抉志抉技 戒忘抖快 妥把快忌抉志忘扶我攸: 忘抗找我志扶抉扼找抆, 忱抉忌把抉忪快抖忘找快抖抆扶抉扼找抆, 抉找志快找扼找志快扶扶抉扼找抆 忍抉找抉志扶抉扼找抆 抗 抉忌批折快扶我攻 我 把忘忌抉找快 志 抗抉技忘扶忱快 妙抑 扭把快忱抖忘忍忘快技: 抉扳我扯我忘抖抆扶抉快 抉扳抉把技抖快扶我快 扼 1-抉忍抉 把忘忌抉折快＃","https://www.adzuna.ru/land/ad/1611285569?se=gnH9fb076xGtuUivdyXBjA&utm_medium=api&utm_source=f0c87e31&v=2533387729ED0C5751D1018938CCF43349E6006A",NA,NA,516000,"0","1611285569",0,"eyJhbGciOiJIUzI1NiJ9.eyJpIjoiMTYxMTI4NTU2OSIsInMiOiJnbkg5ZmIwNzZ4R3R1VWl2ZHlYQmpBIn0.IUiiM9USiRLxvovCJroyBRbDScBUbUQeI4uU9YKiyLY","2020-07-22T01:55:46Z","Adzuna::API::Response::Job",NA,"part_time","Adzuna::API::Response::Category","妥抉把忍抉志抖攸 我 扼忌抑找","sales-jobs","Adzuna::API::Response::Company","妣快扶找忘 ","妙抉扼抗抉志扼抗忘攸 抉忌抖忘扼找抆, 妓抉扼扼我攸","Adzuna::API::Response::Location","c(""妓抉扼扼我攸"", ""妙抉扼抗抉志扼抗忘攸 抉忌抖忘扼找抆"")"
"613","坐把批戒折我抗-把忘戒扶抉把忘忌抉折我抄 扶忘 技抉抖抉抗抉戒忘志抉忱","妓忘忌抉找忘 志忘抒找抉抄 志 妙抉扼抗志快 扼 忌快扼扭抖忘找扶抑技 扭把抉忪我志忘扶我快技 我 忌快扼扭抖忘找扶抑技 扭我找忘扶我快技 抉找 扭把攸技抉忍抉 把忘忌抉找抉忱忘找快抖攸. 妍找扼批找扼找志我快 找把忘找 扶忘 扭把抉忪我志忘扶我快, 扭把抉快戒忱 我 扭我找忘扶我快 - 抉找抖我折扶忘攸 志抉戒技抉忪扶抉扼找抆 戒忘把忘忌抉找忘找抆 妍扳抉把技抖快扶我快 我 戒忘扼快抖快扶我快 志 忱快扶抆 扭把我快戒忱忘 抗 扶忘技 志 抉扳我扼 圾抑抒抉忱 扶忘 把忘忌抉找批 扶忘 扼抖快忱批攻投我抄 忱快扶抆. 圾扼忸 折快扼找扶抉 我 扭把抉戒把忘折扶抉: - 批扼抖抉志我攸, 批把抉志快扶抆 忱抉抒抉忱忘, 扼志抉快志把快技快扶扶忘攸 戒/扭. 孝扼抖抉志我攸: 妓忘忌抉找忘 志忘抒找抉志抑技 技快找抉忱抉技 志 妙抉扼抗志快 我 妙抉扼抗抉志扼抗抉抄 抉忌抖忘扼找我. 坐把忘扳我抗 把忘忌抉找抑 5/2, 6/1 我抖我 7/0 扭抉 志抑忌抉把批. 妊技快扶抑 忱扶快志扶抑快, 扶抉折扶抑快, 折忘扼 扶忘 抉忌快忱 我 扭快把快把抑志抑. 妓忘忌抉找忘 找抉抖抆抗抉＃","https://www.adzuna.ru/land/ad/1529109819?se=gnH9fb076xGtuUivdyXBjA&utm_medium=api&utm_source=f0c87e31&v=C8EE79E238643EC7BE866890492B026D8FC96DC8",55.78609,37.2074,747600,"0","1529109819",588000,"eyJhbGciOiJIUzI1NiJ9.eyJpIjoiMTUyOTEwOTgxOSIsInMiOiJnbkg5ZmIwNzZ4R3R1VWl2ZHlYQmpBIn0.pQzjx8H8lIfJOQ1CE48iCRsCsjTLJwB0Aa9KhFY_wqg","2020-04-25T13:09:38Z","Adzuna::API::Response::Job",NA,NA,"Adzuna::API::Response::Category","妝忘抗批扭抗我 我 扼扶忘忌忪快扶我快","logistics-warehouse-jobs","Adzuna::API::Response::Company","孜抉把找批扶忘","妙抉扼抗志忘, 妙抉扼抗抉志扼抗忘攸 抉忌抖忘扼找抆","Adzuna::API::Response::Location","c(""妓抉扼扼我攸"", ""妙抉扼抗抉志扼抗忘攸 抉忌抖忘扼找抆"", ""妙抉扼抗志忘"")"
"614","坐把批戒折我抗 扶忘 扼抗抖忘忱","妍忌攸戒忘扶扶抉扼找我: 妤把我忸技抗忘 找抉志忘把忘. 妓忘戒忍把批戒抗忘 找抉志忘把忘. 妊忌抉把 扭把抉忱批抗扯我我 志 扼抉抉找志快找扼找志我我 扼 戒忘抗忘戒忘技我. 妤快把快技快投快扶我快 找抉志忘把忘 扭抉 扼抗抖忘忱批. 孝扼抖抉志我攸: 坐把忘扳我抗 把忘忌抉找抑 抗抉技扭忘扶我我 7/0 坏抉扼找抉抄扶抑抄 批把抉志快扶抆 抉扭抖忘找抑 找把批忱忘. 妊抗抖忘忱 扶忘抒抉忱我找扼攸 扭抉 忘忱把快扼批 忍. 妙抉扼抗志忘, 批抖. 妝抉把忍快, 忱抉技 17均 妤把快忱抉扼找忘志抖攸快找扼攸 忌快戒 扭抖忘找扶抉快 忪我抖抆忸. 妊志抉快志把快技快扶扶抑快 志抑扭抖忘找抑 戒忘把扭抖忘找抑.","https://www.adzuna.ru/land/ad/1793089715?se=gnH9fb076xGtuUivdyXBjA&utm_medium=api&utm_source=f0c87e31&v=D4CA0EB91B9FB808AD26AEDF84CF907A18F6D731",55.78609,37.2074,540000,"0","1793089715",480000,"eyJhbGciOiJIUzI1NiJ9.eyJpIjoiMTc5MzA4OTcxNSIsInMiOiJnbkg5ZmIwNzZ4R3R1VWl2ZHlYQmpBIn0.nAXDag2TWT8CuVTvLpquKGK-EHn2ZoAfTEFAgeP3Z0E","2020-10-31T01:09:49Z","Adzuna::API::Response::Job",NA,NA,"Adzuna::API::Response::Category","妝忘抗批扭抗我 我 扼扶忘忌忪快扶我快","logistics-warehouse-jobs","Adzuna::API::Response::Company","圾妍妣宋圻坎妖均岐 圾妍坏均","妙抉扼抗志忘, 妙抉扼抗抉志扼抗忘攸 抉忌抖忘扼找抆","Adzuna::API::Response::Location","c(""妓抉扼扼我攸"", ""妙抉扼抗抉志扼抗忘攸 抉忌抖忘扼找抆"", ""妙抉扼抗志忘"")"
"615","均忱技我扶我扼找把忘找抉把","妍忌攸戒忘扶扶抉扼找我: 志扼找把快折忘 抗抖我快扶找抉志 扶忘 扭把我快技抗快 扼快把志我扼忘, 我抒 把忘扼扭把快忱快抖快扶我快, 扭快把志我折扶忘攸 抗抉扶扼批抖抆找忘扯我攸 扭抉 戒抉扶忘技 抉找忱抑抒忘, 扭把忘志我抖 扶忘抒抉忪忱快扶我攸 扶忘 找快把把我找抉把我我 坏扯, 技快扼找抉扭抉抖抉忪快扶我攸 技快找把抉 抉扼找忘扶抉志抉抗 抉忌投快扼找志快扶扶抉忍抉 找把忘扶扼扭抉把找忘, 技忘忍忘戒我扶抉志 我 抗忘扳快 扭把我快技 戒志抉扶抗抉志 扶忘 忘志找抉扼快把志我扼, 扭把我快技 戒忘抗忘戒抉志 扶忘 批扼抖批忍我, 扭把快忱抖抉忪快扶我快 批扼抖批忍, 忘抗扯我抄 抗抖我快扶找忘技 抉扭找我技我戒忘扯我攸 我 扭抖忘扶我把抉志忘扶我快 戒忘扭我扼我 扶忘 忘志找抉扼快把志我扼 抉扳抉把技抖快扶我快 扼快把志我扼扶抉抄 忱抉抗批技快扶找忘扯我我 扼抉忌抖攻忱快扶我快 扼找忘扶忱忘把找抉志 扭把抉我戒志抉忱我找快抖攸 抗抉扶扼批抖抆找我把抉志忘扶我快 抗抖我快扶找抉志 扭抉 志抉扭把抉扼忘技 戒忘扭我扼我 我 把快技抉扶找忘 扶忘扭抉技我扶忘扶我快 抗抖我快扶找忘技＃","https://www.adzuna.ru/land/ad/1865405645?se=gnH9fb076xGtuUivdyXBjA&utm_medium=api&utm_source=f0c87e31&v=62D21161D86CB0EDA0D1AD09A7B284560A3DC640",55.78609,37.2074,9e+05,"0","1865405645",420000,"eyJhbGciOiJIUzI1NiJ9.eyJzIjoiZ25IOWZiMDc2eEd0dVVpdmR5WEJqQSIsImkiOiIxODY1NDA1NjQ1In0.QvER9p6ViY_GPL1uQZQ8fF-8pKQmWgTqUfDlYku_kxo","2020-12-06T17:25:06Z","Adzuna::API::Response::Job",NA,"part_time","Adzuna::API::Response::Category","均忱技我扶我扼找把忘找我志扶抑抄 扭快把扼抉扶忘抖 我 扼快抗把快找忘把我忘找","admin-jobs","Adzuna::API::Response::Company","妥抉找忘抖","妙抉扼抗志忘, 妙抉扼抗抉志扼抗忘攸 抉忌抖忘扼找抆","Adzuna::API::Response::Location","c(""妓抉扼扼我攸"", ""妙抉扼抗抉志扼抗忘攸 抉忌抖忘扼找抆"", ""妙抉扼抗志忘"")"
"616","均扶忘抖我找我抗 (Ivr)","妖忘扮 扭把抉忱批抗找: 妒扶找快抖抖快抗找批忘抖抆扶抑抄 Ivr 忱抖攸 抗抉把扭抉把忘找我志扶抑抒 妞抖我快扶找抉志 妊忌快把忘 志 抗抉扶找忘抗找扶抉技 扯快扶找把快 扶忘 忌忘戒快 Avaya 妖忘扮忘 抗抉技忘扶忱忘: 妓忘戒把忘忌抉找折我抗我, 扼我扼找快技扶抑快 忘扶忘抖我找我抗我, data-忘扶忘抖我找我抗我 我 志抖忘忱快抖快扯 扭把抉忱批抗找忘. 妊扭抖抉折忸扶扶忘攸 抗抉技忘扶忱忘, 忪快抖忘攻投忘攸 忱抉扼找我折抆 忘技忌我扯我抉戒扶抉抄 扯快抖我 每 扼抉戒忱忘找抆 我 把忘戒志我志忘找抆 我扶找快抖抖快抗找批忘抖抆扶抑抄 Ivr, 批戒扶忘攻投我抄 扭把我折我扶批 戒志抉扶抗忘 妞抖我快扶找忘 志 坎忘扶抗. 妝忘忱忘折我: 妓忘忌抉找忘 扼 戒忘抗忘戒折我抗忘技我, 扼忌抉把 找把快忌抉志忘扶我抄 我 扭抉忪快抖忘扶我抄 扭抉 扭把抉忱批抗找批 我戒 把忘戒扶抑抒 我扼找抉折扶我抗抉志; 妊我扼找快技忘找我戒忘扯我攸 扼抉忌把忘扶扶抉忍抉 技忘找快把我忘抖忘 志 抉扭我扼忘扶我快 抗抖我快扶找扼抗抉忍抉 扭批找我 我抖我 忘抖忍抉把我找技 忌我戒扶快扼＃","https://www.adzuna.ru/land/ad/1846859462?se=gnH9fb076xGtuUivdyXBjA&utm_medium=api&utm_source=f0c87e31&v=87C4D2DFF21C98F5EEDC11D2B320BED7558783B6",55.78609,37.2074,NA,"0","1846859462",NA,"eyJhbGciOiJIUzI1NiJ9.eyJpIjoiMTg0Njg1OTQ2MiIsInMiOiJnbkg5ZmIwNzZ4R3R1VWl2ZHlYQmpBIn0.PzMKgmzZjZ42QAIOs_332ErNyiqauZ9-GGSxpwJpogc","2020-11-27T03:33:57Z","Adzuna::API::Response::Job",NA,"full_time","Adzuna::API::Response::Category","Unknown","unknown","Adzuna::API::Response::Company","妊坎圻妓","妙抉扼抗志忘, 妙抉扼抗抉志扼抗忘攸 抉忌抖忘扼找抆","Adzuna::API::Response::Location","c(""妓抉扼扼我攸"", ""妙抉扼抗抉志扼抗忘攸 抉忌抖忘扼找抆"", ""妙抉扼抗志忘"")"
"617","坐把批戒折我抗-技快把折快扶忱忘抄戒快把 志 孜我抗扼扭把忘抄扼","妍忌攸戒忘扶扶抉扼找我: 把忘戒忍把批戒抗忘 技忘扮我扶; 志抑抗抖忘忱抗忘 找抉志忘把忘 志 找抉把忍抉志抉技 戒忘抖快; 扭把快扼扼抉志抗忘 抗忘把找抉扶忘; 妥把快忌抉志忘扶我攸: 扭批扶抗找批忘抖抆扶抉扼找抆; 志扶我技忘找快抖抆扶抉扼找抆; 孝扼抖抉志我攸: 扭抉折忘扼抉志忘攸 抉扭抖忘找忘; 忍我忌抗我抄 忍把忘扳我抗 把忘忌抉找抑 ; 把忘忌抉找忘 把攸忱抉技 扼 忱抉技抉技;","https://www.adzuna.ru/land/ad/1622778039?se=gnH9fb076xGtuUivdyXBjA&utm_medium=api&utm_source=f0c87e31&v=E0FC0AE10BECDB554A75EF55C8DDA4A8B0545827",53.1803,50.20071,3e+05,"0","1622778039",3e+05,"eyJhbGciOiJIUzI1NiJ9.eyJzIjoiZ25IOWZiMDc2eEd0dVVpdmR5WEJqQSIsImkiOiIxNjIyNzc4MDM5In0.LiCerR86_O6AqFrYTDBef5n2WgQ9ghhg9V4slxOv8IY","2020-07-31T16:21:23Z","Adzuna::API::Response::Job",NA,"part_time","Adzuna::API::Response::Category","妥抉把忍抉志抖攸 我 扼忌抑找","sales-jobs","Adzuna::API::Response::Company","坐妞 Priority","妊忘技忘把忘, 妊忘技忘把扼抗忘攸 抉忌抖忘扼找抆","Adzuna::API::Response::Location","c(""妓抉扼扼我攸"", ""妊忘技忘把扼抗忘攸 抉忌抖忘扼找抆"", ""妊忘技忘把忘"")"
"618","孝忌抉把投我抗 扭把抉我戒志抉忱扼找志快扶扶抑抒 我 扼抖批忪快忌扶抑抒 扭抉技快投快扶我抄","妍忌攸戒忘扶扶抉扼找我: 批忌抉把抗忘 扭把抉我戒志抉忱扼找志快扶扶抑抒 我 扼抖批忪快忌扶抑抒 扭抉技快投快扶我抄; 技抉抄抗忘 扭抉扼批忱抑. 妥把快忌抉志忘扶我攸: 忪快抖忘扶我快 把忘忌抉找忘找抆. 孝扼抖抉志我攸: 抉扳抉把技抖快扶我快 扭抉 找把批忱抉志抉抄 抗扶我忪抗快, 我扼扭抑找忘找快抖抆扶抑抄 扼把抉抗 3 技快扼攸扯忘.","https://www.adzuna.ru/land/ad/1699022823?se=gnH9fb076xGtuUivdyXBjA&utm_medium=api&utm_source=f0c87e31&v=9BC982F5112B177FE6B1ED501245BB6A74768429",59.93904,30.31579,270000,"0","1699022823",270000,"eyJhbGciOiJIUzI1NiJ9.eyJpIjoiMTY5OTAyMjgyMyIsInMiOiJnbkg5ZmIwNzZ4R3R1VWl2ZHlYQmpBIn0.B7dEFlDlyQAZBuJEhtfYBX_UARnA4YrrcyiEB-d00XY","2020-09-11T20:30:07Z","Adzuna::API::Response::Job",NA,"full_time","Adzuna::API::Response::Category","Unknown","unknown","Adzuna::API::Response::Company","""妖妤妤"" 妞把忘扼扶抉戒扶忘技忸扶快扯"", 均妍","妊忘扶抗找-妤快找快把忌批把忍, 妣快扶我扶忍把忘忱扼抗忘攸 抉忌抖忘扼找抆","Adzuna::API::Response::Location","c(""妓抉扼扼我攸"", ""妣快扶我扶忍把忘忱扼抗忘攸 抉忌抖忘扼找抆"", ""妊忘扶抗找-妤快找快把忌批把忍"")"
